{
  "$schema": "https://json-schema.org/draft/2020-12/schema",
  "$id": "world.schema.json",
  "title": "World (data/world.json)",
  "description": "How rooms connect, where they sit on the world map, and the key fragments (D101). The core is an object in a room (defs.json kind \"core\"); where fragments lie is the rooms' pickups.",
  "type": "object",
  "required": ["schemaVersion", "start", "connections", "positions"],
  "additionalProperties": false,
  "properties": {
    "$schema": { "type": "string" },
    "schemaVersion": { "$ref": "common.schema.json#/$defs/schemaVersion" },
    "start": { "$ref": "common.schema.json#/$defs/id", "description": "Room the game starts in." },
    "connections": {
      "description": "Pairs of connected exits as \"room.exit\". Exits must be on opposite sides and equally wide.",
      "type": "array",
      "items": {
        "type": "array",
        "items": { "type": "string", "pattern": "^[a-z][a-z0-9_]*\\.[a-z][a-z0-9_]*$" },
        "minItems": 2,
        "maxItems": 2
      }
    },
    "dev": {
      "description": "The dev wing (D147): rooms only the dev server shows. A build for players leaves them out, with their connections and map positions; an exit of a player room that led into one becomes wall. The start room is never in it.",
      "type": "array",
      "items": { "$ref": "common.schema.json#/$defs/id" },
      "uniqueItems": true
    },
    "later": {
      "description": "Spells and upgrades the world will hand out in sectors not built yet (D183). The reachability checker takes a room, exit or pickup that needs one of them as a warning, not an error, while no disk or upgrade for it lies in any room.",
      "type": "array",
      "items": { "enum": ["zap", "scan", "pull", "compile", "fork", "cut_paste", "blink", "warp", "pause", "shield", "firewall"] },
      "uniqueItems": true
    },
    "pending": {
      "description": "Rooms still waiting for something not placed yet, such as a secret whose entrance comes later. The reachability checker reports their problems as warnings, so they never fail CI or a release; remove a room from here once it is finished.",
      "type": "array",
      "items": { "type": "string" },
      "uniqueItems": true
    },
    "fragments": {
      "description": "Key fragments (D101): how many end the game at the core, and the access levels they earn there.",
      "type": "object",
      "required": ["required", "access"],
      "additionalProperties": false,
      "properties": {
        "required": { "type": "integer", "minimum": 1, "maximum": 64, "description": "Fragments the core needs to reboot the Grid (the end of the game)." },
        "access": {
          "description": "Fragments found for each access level, in rising order: [16, 32, 48] gives level 1 at 16, 2 at 32, 3 at 48. The core raises the level when he touches it.",
          "type": "array",
          "items": { "type": "integer", "minimum": 1, "maximum": 64 },
          "maxItems": 15
        }
      }
    },
    "positions": {
      "description": "Every room's cell on the world map (D66) as [x, z], by room id: +x is east, +z is south, as in a room. One room per cell; neighbours on the map need not be connected.",
      "type": "object",
      "propertyNames": { "$ref": "common.schema.json#/$defs/id" },
      "additionalProperties": {
        "type": "array",
        "prefixItems": [{ "type": "integer" }, { "type": "integer" }],
        "items": false,
        "minItems": 2
      }
    }
  }
}
