{
  "$schema": "../schemas/world.schema.json",
  "schemaVersion": 1,
  "start": "boot_up",
  "dev": [
    "hidden_layer",
    "room_1",
    "room_2",
    "fence_yard",
    "watchdog_run",
    "socket_lab",
    "stream_lab",
    "spiked_lab",
    "heavy_lab",
    "socket_yard",
    "cage_lab",
    "stair_lab"
  ],
  "later": ["compile", "warp"],
  "fragments": { "required": 64, "access": [16, 32, 48] },
  "connections": [
    ["first_steps.east", "zap_port.west"],
    ["zap_port.north", "first_light.south"],
    ["zap_port.east", "atrium.west"],
    ["atrium.north", "shield_hall.south"],
    ["atrium.south", "freeze_hall.north"],
    ["shield_hall.north", "bolt_gallery.south"],
    ["bolt_gallery.north", "relay_loft.south"],
    ["relay_loft.west", "ledger_cell.east"],
    ["relay_loft.east", "scan_lab.west"],
    ["scan_lab.east", "mirror_stacks.west"],
    ["mirror_stacks.south", "ghost_exit.north"],
    ["ghost_exit.west", "junction.east"],
    ["junction.north", "scan_lab.south"],
    ["junction.south", "drift_bay.north"],
    ["freeze_hall.south", "cold_stairs.north"],
    ["cold_stairs.south", "warden_pit.north"],
    ["cold_stairs.east", "fork_lab.west"],
    ["fork_lab.east", "twin_plates.west"],
    ["twin_plates.north", "guard_loop.south"],
    ["guard_loop.west", "split_vault.east"],
    ["drift_bay.south", "gatekeeper.north"],
    ["gatekeeper.south", "split_vault.north"],
    ["gatekeeper.east", "core_hall.west"],
    ["core_hall.north", "dj_vault.south"],
    ["dj_vault.east", "frost_gate.west"],
    ["frost_gate.east", "frost_edge.west"],
    ["core_hall.east", "glitch_gate.west"],
    ["glitch_gate.east", "glitch_edge.west"],
    ["warden_pit.south", "idle_cache.north"],
    ["room_2.east", "room_1.west"],
    ["room_1.east", "socket_lab.west"],
    ["socket_lab.east", "heavy_lab.west"],
    ["room_2.north", "socket_yard.south"],
    ["heavy_lab.north", "cage_lab.south"],
    ["cage_lab.west", "stair_lab.east"],
    ["room_1.north", "spiked_lab.south"],
    ["fence_yard.east", "room_2.west"],
    ["watchdog_run.east", "fence_yard.west"],
    ["boot_up.east", "first_steps.west"],
    ["boot_up.west", "hidden_layer.east"],
    ["hidden_layer.west", "stream_lab.east"],
    ["warden_pit.west", "buffer_2.east"],
    ["ghost_exit.east", "buffer_5.west"],
    ["scan_lab.north_2", "buffer_1.south"],
    ["guard_loop.east", "buffer_3.west"],
    ["mirror_stacks.east_2", "buffer_4.west"]
  ],
  "positions": {
    "hidden_layer": [4, 0],
    "stream_lab": [3, 0],
    "boot_up": [5, 0],
    "first_steps": [6, 0],
    "zap_port": [7, 0],
    "first_light": [7, -1],
    "atrium": [8, 0],
    "shield_hall": [8, -1],
    "freeze_hall": [8, 1],
    "cold_stairs": [8, 2],
    "warden_pit": [8, 3],
    "idle_cache": [8, 4],
    "fork_lab": [9, 2],
    "twin_plates": [10, 2],
    "guard_loop": [10, 1],
    "split_vault": [9, 1],
    "gatekeeper": [9, 0],
    "core_hall": [10, 0],
    "dj_vault": [10, -1],
    "frost_gate": [11, -1],
    "frost_edge": [12, -1],
    "glitch_gate": [11, 0],
    "glitch_edge": [12, 0],
    "bolt_gallery": [8, -2],
    "relay_loft": [8, -3],
    "ledger_cell": [7, -3],
    "scan_lab": [9, -3],
    "mirror_stacks": [10, -3],
    "ghost_exit": [10, -2],
    "junction": [9, -2],
    "drift_bay": [9, -1],
    "room_1": [4, -1],
    "socket_lab": [5, -1],
    "heavy_lab": [6, -1],
    "socket_yard": [3, -2],
    "cage_lab": [6, -2],
    "stair_lab": [5, -2],
    "spiked_lab": [4, -2],
    "room_2": [3, -1],
    "fence_yard": [2, -1],
    "watchdog_run": [1, -1],
    "buffer_1": [9, -4],
    "buffer_2": [7, 3],
    "buffer_3": [11, 1],
    "buffer_4": [11, -3],
    "buffer_5": [11, -2]
  }
}
